{
  "scenario_id": "discipline_demo_v1",
  "version": "1.0",
  "source": "纪律打断演示场景：被告第3次发言注入违规台词，默认25轮法官发言",
  "five_w_one_h": {
    "who": "原告李某（代理人张律师）；被告王某（代理人王律师）",
    "what": "民间借贷纠纷",
    "when": "2024年起诉",
    "where": "某市某区人民法院",
    "why": "原告主张被告欠款未还，被告否认",
    "how": "协商失败后起诉"
  },
  "narrative": {
    "title": "纪律打断演示庭审",
    "synopsis": "短庭审用于验证 discipline_validator → matchmaker_discipline → post_moderation_coach 链路。双方均有律师；被告本人第3次发言将注入「我草泥马！」。",
    "atmosphere": "独任审理，情绪张力中等"
  },
  "venue": "某市某区人民法院",
  "meeting_type": "民事一审｜民间借贷纠纷",
  "parties": {
    "matchmaker": { "name": "审判员陈某" },
    "clerk": { "name": "书记员赵某" },
    "male": {
      "name": "李某",
      "has_lawyer": true,
      "lawyer_name": "张律师",
      "profile": "出借人，主张被告欠款5万元"
    },
    "male_parents": {
      "name": "张律师",
      "profile": "原告诉讼代理人"
    },
    "female": {
      "name": "王某",
      "has_lawyer": true,
      "lawyer_name": "王律师",
      "profile": "借款人，否认欠款，性格急躁"
    },
    "female_parents": {
      "name": "王律师",
      "profile": "被告诉讼代理人"
    }
  },
  "ideal_partner_notes": "判令被告王某偿还借款本金50000元及利息。",
  "tension_points": ["借款是否实际交付", "被告是否已部分还款"],
  "value_tensions": [],
  "relationship_issues": [],
  "trait_pool": {
    "total_count": 4,
    "description": "演示用最小证据池",
    "items": [
      {
        "id": "E01",
        "name": "借条",
        "description": "原告提交的借条复印件",
        "holder": "male",
        "submitted_by": "male",
        "status": "submitted"
      },
      {
        "id": "E02",
        "name": "转账记录",
        "description": "银行转账凭证",
        "holder": "male",
        "submitted_by": "male",
        "status": "submitted"
      },
      {
        "id": "E03",
        "name": "被告还款说明",
        "description": "被告主张已部分还款的说明",
        "holder": "female",
        "submitted_by": "female",
        "status": "submitted"
      },
      {
        "id": "E04",
        "name": "证人证言",
        "description": "证人关于借款过程的证言",
        "holder": "female",
        "status": "available"
      }
    ],
    "male_bundle": ["E01", "E02"],
    "female_bundle": ["E03"]
  },
  "simulation": {
    "max_rounds": 27,
    "male_has_lawyer": true,
    "female_has_lawyer": true,
    "seed": 42,
    "behavior": {
      "discipline_demo": {
        "enabled": true,
        "role": "female",
        "speech_index": 3,
        "text": "我草泥马！",
        "prefer_party_over_lawyer": true
      }
    }
  }
}
